{
  "id": "1h6pmb3ntfmogfppknk9aefpvs",
  "datastream@id": "4e7lckktgdqq",
  "foi@id": "wkigzi6hv817",
  "phenomenonTime": "2022-07-16T20:00:00Z",
  "resultTime": "2022-07-16T20:00:00Z",
  "result": {
    "TEMP_AIR_MEAN": 28.63,
    "BARO_PRES_MEAN": 1013.93,
    "WIND_FROM_MEAN": 84.9,
    "WIND_SPEED_MEAN": 7.01,
    "RH_MEAN": 84.08
  }
}